{
  "schema_version": 1,
  "kind": "wordpress-sync-project",
  "project_key": "example-project",
  "site_key": "example-site",
  "environment": "development",
  "canonical_url": "https://example.invalid",
  "transport": {
    "kind": "fixture",
    "state_path": "fixture-remote-v1.json"
  },
  "credential_ref": null,
  "repository_root": ".",
  "ownership_policy": {
    "code": "git",
    "content": "shared-guarded",
    "media": "manifest",
    "generated": "runtime-generated"
  },
  "adapter_policy": {
    "page": "supported",
    "post": "supported",
    "cpt": "supported",
    "wp_template": "supported",
    "wp_template_part": "supported",
    "wp_navigation": "supported",
    "wp_global_styles": "supported",
    "wp_block": "supported",
    "attachment": "supported",
    "acf_field_group": "supported",
    "acf_values": "supported"
  },
  "limits": {
    "max_objects": 1000,
    "max_json_bytes": 2097152,
    "max_wave_size": 10
  }
}
